{
 "generated_at": "2026-08-29T23:25:19.344Z",
 "generated_by": "registry.mjs laws collect (DERIVED — hand edits are the drift disease)",
 "_two_kinds_law": "F-7: standing_laws carry law text AND a check_site; ruling_pointers carry a ruling document's title and check_site:null. They are NEVER summed — there is no total in this file, and 'N laws' may not be written of the pair.",
 "queue_dir": "C:\\Users\\nikhi\\arsenal-audit-artifacts\\queue",
 "queue_reachable": true,
 "counts": {
  "standing_laws": 14,
  "ruling_pointers": 73
 },
 "standing_laws": [
  {
   "law_id": "10D-1",
   "statement": "Open THIS file first. Execute exactly ONE unticked rung. Never two. The ▶ NEXT SESSION",
   "source_file": "C:\\Users\\nikhi\\GitHub\\arsenal-ai-fc\\docs\\archive\\ORGANISM_AUDIT__2026-08-19.md",
   "scope": "standing",
   "check_site": "§10-D"
  },
  {
   "law_id": "10D-2",
   "statement": "The rung's ceiling is a STOP, not a suggestion — hand off cleanly at it.",
   "source_file": "C:\\Users\\nikhi\\GitHub\\arsenal-ai-fc\\docs\\archive\\ORGANISM_AUDIT__2026-08-19.md",
   "scope": "standing",
   "check_site": "§10-D"
  },
  {
   "law_id": "10D-3",
   "statement": "No subagents/fleets anywhere except where a rung names them, never without a ceiling.",
   "source_file": "C:\\Users\\nikhi\\GitHub\\arsenal-ai-fc\\docs\\archive\\ORGANISM_AUDIT__2026-08-19.md",
   "scope": "standing",
   "check_site": "§10-D"
  },
  {
   "law_id": "10D-4",
   "statement": "State files are written by their owner CLIs only — never by a session's editor.",
   "source_file": "C:\\Users\\nikhi\\GitHub\\arsenal-ai-fc\\docs\\archive\\ORGANISM_AUDIT__2026-08-19.md",
   "scope": "standing",
   "check_site": "§10-D"
  },
  {
   "law_id": "10D-5",
   "statement": "§4's rule binds everything new too: every instrument — S3's tools, every Gemini return, every",
   "source_file": "C:\\Users\\nikhi\\GitHub\\arsenal-ai-fc\\docs\\archive\\ORGANISM_AUDIT__2026-08-19.md",
   "scope": "standing",
   "check_site": "§10-D"
  },
  {
   "law_id": "10D-6",
   "statement": "A gate may only get stricter. A rung that weakens any gate is refused, whole.",
   "source_file": "C:\\Users\\nikhi\\GitHub\\arsenal-ai-fc\\docs\\archive\\ORGANISM_AUDIT__2026-08-19.md",
   "scope": "standing",
   "check_site": "§10-D"
  },
  {
   "law_id": "10D-7",
   "statement": "Before stopping: RESUME + ticks (only what is TRUE) · PROGRESS entry · §3-C check · commit.",
   "source_file": "C:\\Users\\nikhi\\GitHub\\arsenal-ai-fc\\docs\\archive\\ORGANISM_AUDIT__2026-08-19.md",
   "scope": "standing",
   "check_site": "§10-D"
  },
  {
   "law_id": "10D-8",
   "statement": "Speak to him in one short block: what landed · what it cost · the one decision, if any —",
   "source_file": "C:\\Users\\nikhi\\GitHub\\arsenal-ai-fc\\docs\\archive\\ORGANISM_AUDIT__2026-08-19.md",
   "scope": "standing",
   "check_site": "§10-D"
  },
  {
   "law_id": "10D-9",
   "statement": "THE MICRO-ORDER RULE (first act, before any edit): write the rung's micro-order into the",
   "source_file": "C:\\Users\\nikhi\\GitHub\\arsenal-ai-fc\\docs\\archive\\ORGANISM_AUDIT__2026-08-19.md",
   "scope": "standing",
   "check_site": "§10-D"
  },
  {
   "law_id": "10D-10",
   "statement": "THE FAILURE PROTOCOL: a DONE-proof that stays red = STOP. Record in PROGRESS what failed",
   "source_file": "C:\\Users\\nikhi\\GitHub\\arsenal-ai-fc\\docs\\archive\\ORGANISM_AUDIT__2026-08-19.md",
   "scope": "standing",
   "check_site": "§10-D"
  },
  {
   "law_id": "10D-11",
   "statement": "VERSIONS MOVE ALONE (§10-G): a runtime/dependency/model-roster bump is its OWN commit,",
   "source_file": "C:\\Users\\nikhi\\GitHub\\arsenal-ai-fc\\docs\\archive\\ORGANISM_AUDIT__2026-08-19.md",
   "scope": "standing",
   "check_site": "§10-D"
  },
  {
   "law_id": "10D-12",
   "statement": "MODEL ROUTING BINDS (§10-F): the rung's MODEL line is part of the rung. Fable-pool dry ⇒",
   "source_file": "C:\\Users\\nikhi\\GitHub\\arsenal-ai-fc\\docs\\archive\\ORGANISM_AUDIT__2026-08-19.md",
   "scope": "standing",
   "check_site": "§10-D"
  },
  {
   "law_id": "10D-13",
   "statement": "THE ESCALATION RULE — his order, 20 Aug 2026: never take a lower-quality decision alone.",
   "source_file": "C:\\Users\\nikhi\\GitHub\\arsenal-ai-fc\\docs\\archive\\ORGANISM_AUDIT__2026-08-19.md",
   "scope": "standing",
   "check_site": "§10-D"
  },
  {
   "law_id": "10D-13b",
   "statement": "THE ESCALATION RULE — his order, 20 Aug 2026: never take a lower-quality decision alone.",
   "source_file": "C:\\Users\\nikhi\\GitHub\\arsenal-ai-fc\\docs\\archive\\ORGANISM_AUDIT__2026-08-19.md",
   "scope": "standing",
   "check_site": "§10-D"
  }
 ],
 "ruling_pointers": [
  {
   "law_id": "RULING__2026-08-25_0805-s5pre-1",
   "title": "RULING · 2026-08-25 ~08:40 IST · architect — the dead §3-C commit gate",
   "statement": "RULING · 2026-08-25 ~08:40 IST · architect — the dead §3-C commit gate",
   "source_file": "C:\\Users\\nikhi\\arsenal-audit-artifacts\\queue\\RULING__2026-08-25_0805-s5pre-1.md",
   "scope": "ruling",
   "check_site": null
  },
  {
   "law_id": "RULING__2026-08-25_0915-ceiling-policy",
   "title": "RULING · review-rung ceiling policy · 25 Aug 2026 ~09:15 IST · architect (Fable·max)",
   "statement": "RULING · review-rung ceiling policy · 25 Aug 2026 ~09:15 IST · architect (Fable·max)",
   "source_file": "C:\\Users\\nikhi\\arsenal-audit-artifacts\\queue\\RULING__2026-08-25_0915-ceiling-policy.md",
   "scope": "ruling",
   "check_site": null
  },
  {
   "law_id": "RULING__2026-08-25_0945-s5canon-1",
   "title": "RULING · S5 canon window unrunnable (10-attachment cap) · 25 Aug 2026 ~09:55 IST · architect (Fable·max)",
   "statement": "RULING · S5 canon window unrunnable (10-attachment cap) · 25 Aug 2026 ~09:55 IST · architect (Fable·max)",
   "source_file": "C:\\Users\\nikhi\\arsenal-audit-artifacts\\queue\\RULING__2026-08-25_0945-s5canon-1.md",
   "scope": "ruling",
   "check_site": null
  },
  {
   "law_id": "RULING__2026-08-25_1030-s5w-1",
   "title": "RULING · S5-W's six items · 25 Aug 2026 ~10:45 IST · architect (Fable·max)",
   "statement": "RULING · S5-W's six items · 25 Aug 2026 ~10:45 IST · architect (Fable·max)",
   "source_file": "C:\\Users\\nikhi\\arsenal-audit-artifacts\\queue\\RULING__2026-08-25_1030-s5w-1.md",
   "scope": "ruling",
   "check_site": null
  },
  {
   "law_id": "RULING__2026-08-25_1100-s5x-1",
   "title": "RULING · preflight/checkall clipboard gate vs the sweep's real path · 25 Aug 2026 ~11:25 IST · architect (Fable·max)",
   "statement": "RULING · preflight/checkall clipboard gate vs the sweep's real path · 25 Aug 2026 ~11:25 IST · architect (Fable·max)",
   "source_file": "C:\\Users\\nikhi\\arsenal-audit-artifacts\\queue\\RULING__2026-08-25_1100-s5x-1.md",
   "scope": "ruling",
   "check_site": null
  },
  {
   "law_id": "RULING__2026-08-25_1215-s5y-1",
   "title": "RULING · S5-Y's three items · 25 Aug 2026 ~12:25 IST · architect (Fable·max)",
   "statement": "RULING · S5-Y's three items · 25 Aug 2026 ~12:25 IST · architect (Fable·max)",
   "source_file": "C:\\Users\\nikhi\\arsenal-audit-artifacts\\queue\\RULING__2026-08-25_1215-s5y-1.md",
   "scope": "ruling",
   "check_site": null
  },
  {
   "law_id": "RULING__2026-08-25_1250-s5sweep-1",
   "title": "RULING · the markdown-lossy capture path · 25 Aug 2026 ~13:10 IST · architect (Fable·max)",
   "statement": "RULING · the markdown-lossy capture path · 25 Aug 2026 ~13:10 IST · architect (Fable·max)",
   "source_file": "C:\\Users\\nikhi\\arsenal-audit-artifacts\\queue\\RULING__2026-08-25_1250-s5sweep-1.md",
   "scope": "ruling",
   "check_site": null
  },
  {
   "law_id": "RULING__2026-08-25_1410-s5z-1",
   "title": "RULING · S5-Z's five questions + HIS sync ruling · 25 Aug 2026 ~14:20 IST · architect (Fable·max)",
   "statement": "RULING · S5-Z's five questions + HIS sync ruling · 25 Aug 2026 ~14:20 IST · architect (Fable·max)",
   "source_file": "C:\\Users\\nikhi\\arsenal-audit-artifacts\\queue\\RULING__2026-08-25_1410-s5z-1.md",
   "scope": "ruling",
   "check_site": null
  },
  {
   "law_id": "RULING__2026-08-26_0015-s5z2-1",
   "title": "RULING · answers 2026-08-26_0015-s5z2-1.md (S5-Z2's six) · 26 Aug 2026 ~00:40 IST · architect (Fable·max)",
   "statement": "RULING · answers 2026-08-26_0015-s5z2-1.md (S5-Z2's six) · 26 Aug 2026 ~00:40 IST · architect (Fable·max)",
   "source_file": "C:\\Users\\nikhi\\arsenal-audit-artifacts\\queue\\RULING__2026-08-26_0015-s5z2-1.md",
   "scope": "ruling",
   "check_site": null
  },
  {
   "law_id": "RULING__2026-08-26_0112-s5sweep-2",
   "title": "RULING · answers 2026-08-26_0112-s5sweep-2.md (A02 halt: the serializer dialect) · 26 Aug 2026 ~01:30 IST · architect (Fable·max)",
   "statement": "RULING · answers 2026-08-26_0112-s5sweep-2.md (A02 halt: the serializer dialect) · 26 Aug 2026 ~01:30 IST · architect (Fable·max)",
   "source_file": "C:\\Users\\nikhi\\arsenal-audit-artifacts\\queue\\RULING__2026-08-26_0112-s5sweep-2.md",
   "scope": "ruling",
   "check_site": null
  },
  {
   "law_id": "RULING__2026-08-26_0240-s5z3-1",
   "title": "RULING · answers 2026-08-26_0240-s5z3-1.md (S5-Z3 close: two items) · 26 Aug 2026 ~02:55 IST · architect (Fable·max)",
   "statement": "RULING · answers 2026-08-26_0240-s5z3-1.md (S5-Z3 close: two items) · 26 Aug 2026 ~02:55 IST · architect (Fable·max)",
   "source_file": "C:\\Users\\nikhi\\arsenal-audit-artifacts\\queue\\RULING__2026-08-26_0240-s5z3-1.md",
   "scope": "ruling",
   "check_site": null
  },
  {
   "law_id": "RULING__2026-08-26_0300-s5sweep-3",
   "title": "RULING · answers 2026-08-26_0300-s5sweep-3.md (canon half redesign) · 26 Aug 2026 ~03:15 IST · architect (Fable·max)",
   "statement": "RULING · answers 2026-08-26_0300-s5sweep-3.md (canon half redesign) · 26 Aug 2026 ~03:15 IST · architect (Fable·max)",
   "source_file": "C:\\Users\\nikhi\\arsenal-audit-artifacts\\queue\\RULING__2026-08-26_0300-s5sweep-3.md",
   "scope": "ruling",
   "check_site": null
  },
  {